Hid,State,City,Category,Alcohol,Hotel Name,Address,Start Date,Expiry Date,Total Rooms
371,Kerala,Pathanamthitta,3 Star,,KUTTIES RESIDENCY,"Market Junction ,Konni,Pathanamthitta",21/06/2019,20/06/2024,11
372,Kerala,Pathanamthitta,3 Star,,Shines Tourist Hotel,"P.B.No.5,Pandalam,Pathanamthitta Dist.",12/12/2019,11/12/2024,12
373,Kerala,Pattambi,3 Star,,NAKSHATRA REGENCY,"3,284, PATTAMBI MAIN ROAD, KOPPAM, PALAKKAD, PIN – 679 307",28/07/2022,27/07/2027,12
374,Kerala,Payyanur,3 Star,,HOTEL ARCHANA AND DWARAKA TOURIST HOME,"Main Road, Payyannur, Kannur ",27/05/2019,26/05/2024,22
375,Kerala,Payyanur,3 Star,,K B C GREEN PARK HOTEL,"EDAT,PAYYANUR,KANNUR DIST, KERALA STATE",15/05/2019,14/05/2024,22
376,Kerala,Perumbavoor,3 Star,,EAGLE TOURIST HOME,"M.C. Road, Perumbavoor P.O., Ernakulam",15/06/2021,14/06/2026,10
377,Kerala,Perumbavoor,3 Star,,EMBASSERY RESIDENCY,"KURUPPAMPADY P.O. ERNAKULAM DISTRICT,KERALA STATE",26/11/2018,25/11/2023,11
378,Kerala,Perumbavoor,3 Star,,HOTEL ANJALY INTERNATIONAL,"HOTEL ANJALY INTERNATIONAL, OUSHADHI JN., M.C. ROAD, PERUMBAVOOR",6/9/2018,5/9/2023,10
379,Kerala,Perumbavoor,3 Star,,Manna Tourist Home,"A.M.Road ,Perumbavoor",22/09/2021,21/09/2026,10
380,Kerala,Perumbavoor,3 Star,,RITZ INTERNATIONAL,"A M ROAD, PERUMBAVOOR",17/12/2019,16/12/2024,11
381,Kerala,Ponnani,3 Star,,HOTEL SAAYOOJ,"THRISSUR ROAD, SUKAPURAM PO,EDAPPAL,MALAPURAM DIST. Ponnani",8/3/2020,7/3/2025,10
382,Kerala,Punalur,3 Star,,NARENDRA REGENCY,"GOVT. HOSPITAL ROAD, PUNALUR, KOLLAM",15/05/2019,14/05/2024,11
383,Kerala,Quilandy,3 Star,,Park Residency,"Koyilandy P.O, Kozhikode District",6/8/2020,5/8/2025,15
384,Kerala,Shoranur,3 Star,,Apsara Tourist Home,Opposite to Railway station Shoranur Shoranur,25/10/2021,24/10/2026,10
385,Kerala,Sultan Bathery,3 Star,,HOTEL THE RESORT,"Gandhi junction,Rahim memorial Road,Sulthan bathery,Wayanad Dist, Kerala",5/10/2018,4/10/2023,10
386,Kerala,Taliparamba,3 Star,,HOTEL CHEMBARATHY GARDEN,"7th MILE,KUTTIKKOL PO,TALIPARAMBA VILLAGE,TALIPARAMBA TALUK,KANNUR DISTRICT,",28/06/2019,27/06/2024,17
387,Kerala,Thalikkulam,3 Star,,Central Residency ( Unit of Vynika Hotels Private Limited),"VIII - 495 F, NH-66, Thalikkulam. Post, Thalikkulam Thalikkulam",11/3/2022,10/3/2027,10
388,Kerala,Thekkady,3 Star,,HOLIDAY VISTA (M.S.C Hotels and Resorts Pvt Ltd ),"K.K Road ,Kumuly, Thekkady 685 509,Idukki District",2/9/2019,1/9/2024,52
389,Kerala,Thiruvalla,3 Star,,Hotel Ashok International,"T.K.Road, Thiruvalla, Pathanamthitta",16/07/2021,15/07/2026,10
390,Kerala,Thiruvalla,3 Star,,Hotel Bessota International,"Near YMCA, Tiruvalla, Pathanamthitta, Kerala",21/10/2019,20/10/2024,20
391,Kerala,Thiruvananthapuram,3 Star,,Amala's Residency,"Central Theatre Road,Powerhouse Road,Opposite Railway 2nd Entry,Pazhavangadi,Thiruvananthapuram.",2/4/2019,1/4/2024,16
392,Kerala,Thiruvananthapuram,3 Star,,HOTEL ASLIYYA GRANDE,"NAVAIKULAM, TRIVANDRUM-695603",29/03/2019,28/03/2024,20
393,Kerala,Thiruvananthapuram,3 Star,,HOTEL CITY PALACE,"ARAYALLOOR , THIRUMALA PO , TRIVANDRUM Thiruvananthapuram",6/9/2018,5/9/2023,10
394,Kerala,Thiruvananthapuram,3 Star,,Hotel Flamingo Inn(a unit of flamingo Inn Pvt Ltd),"Opp. Infosys Campus, Technopark, By-pass Medanada Kulathoor .p.o Trivandrum",29/07/2022,28/07/2027,41
395,Kerala,Thiruvananthapuram,3 Star,,HOTEL HIGHNESS INN,"PERUMTHANNI, EANCHACKAL, TRIVANDRUM",20/01/2020,19/01/2025,11
396,Kerala,Thiruvananthapuram,3 Star,,HOTEL INDRAPRASTHA,"HOTEL INDRAPRASTHA, MAITHANAM, VARKALA PO, THIRUVANANTHAPURAM 695141",30/03/2020,29/03/2025,10
397,Kerala,Thiruvananthapuram,3 Star,,HOTEL INDRAPRASTHA,"ATTAKULANGARA P.O.,THIRUVANANTHAPURAM",8/8/2022,7/8/2027,15
398,Kerala,Thiruvananthapuram,3 Star,,Hotel Indrapuri,"TC 26-689-(1&2), Vanross Junction, Trivandrum Thiruvananthapuram Thiruvananthapuram ",12/12/2019,11/12/2024,10
399,Kerala,Thiruvananthapuram,3 Star,,HOTEL PADMA,"CONVENT ROAD, VANCHIYOOR, TRIVANDRUM",8/4/2021,7/4/2026,10
400,Kerala,Thiruvananthapuram,3 Star,,HOTEL PRASANTH ,"HOTEL PRASANTH ( A unit of PRASAD HOTELS PRIVATE LIMITED) TC 11 726, P.M.G Junction, Thiruvananthapuram, 695033, Kerala State",4/7/2018,3/7/2023,51
401,Kerala,Thiruvananthapuram,3 Star,,HOTEL PRASANTHI,"HOTEL PRASANTHI, PARASSALA PO, NEYYATTINKARA, THIRUVANANTHAPURAM, KERALA ",21/02/2020,20/02/2025,15
402,Kerala,Thiruvananthapuram,3 Star,,Hotel Rajadhani,"Hotel Rajadhani, Rajadhani Buildings, East Fort, Thiruvananthapuram - 695 023",9/3/2021,8/3/2026,17
403,Kerala,Thiruvananthapuram,3 Star,,Hotel Safari,"Near KURTC Bus stand,M.C. Road,Venjaramood Thiruvananthapuram",20/11/2018,19/11/2023,19
404,Kerala,Thiruvananthapuram,3 Star,,Leela Backwaters Inn,"Bridge Road, Poovar, Thiruvanthapuram ,Kerala ,India Thiruvananthapuram",21/11/2022,20/11/2027,15
405,Kerala,Thiruvananthapuram,3 Star,,PADMASREE TOURIST HOME,"Chirayinkeezhu,Thiruvananthapuram",9/9/2022,8/9/2027,11
406,Kerala,Thiruvananthapuram,3 Star,,Pattom Royal Hotel,"TC 3 2778-1, Pattom - Plamoodu Reach, Pattom Road",12/2/2019,11/2/2024,45
407,Kerala,Thiruvananthapuram,3 Star,,RACO REGENCY,"MURINJAPALAM, MEDICAL COLLEGE, THIRUVANATHAPURAM",25/07/2022,24/07/2027,12
408,Kerala,Thiruvananthapuram,3 Star,,RUBY ARENA,"Kumarapuram Road, Medical Collage P O, Thiruvananthapuram Dist , Kerala State, Pin-695011",4/1/2023,3/1/2028,40
409,Kerala,Thiruvananthapuram,3 Star,,The Grand Residency ,"Nellimoodu P O, Thiruvananthapuram ",26/10/2022,25/10/2027,16
410,Kerala,Thiruvananthapuram,3 Star,,THE TRAVANCORE HERITAGE (A Unit of Joys The Beach Resort P. Ltd.),"Balaramapuram, Near kovalam, Chowara P.O - 695501 Thiruvananthapuram, Kerala, India, ",16/07/2021,15/07/2026,84
411,Kerala,Thodupuzha,3 Star,,GEMINY TOURIST HOME,"Manakkad Jn, Thodupuzha PO Idukki Dist,",23/04/2019,22/04/2024,17
412,Kerala,Thodupuzha,3 Star,,Hotel Vrindavan,"Vannappuram P O, Thodupuzha, Idukki Dist",22/08/2019,21/08/2024,11
413,Kerala,Thodupuzha,3 Star,,Hotel Xavier's Avenue Pvt. Ltd.,"Paingotoor, Munnar Road, Kothamangalam, Ernakulam dist Thodupuzha",29/11/2018,28/11/2023,20
414,Kerala,Thodupuzha,3 Star,,Tee Cee Restaurant,"Thodupuzha Muvattupuzha Road, Thodupuzha",19/04/2022,18/04/2027,11
415,Kerala,Thripunithura,3 Star,,Kottavathil Restaurant ,"Near Statue Jn. Tripunithura, Ernakulam",27/04/2021,26/04/2026,10
416,Kerala,Thrissur,3 Star,,ASHOKA INN,"SAKTHAN THAMPURAN NAGAR,T.B.ROAD,THRISSUR",6/9/2018,5/9/2023,34
417,Kerala,Thrissur,3 Star,,ASHOKA RESIDENCY,"IRINJALAKUDA ROAD, P.O.KATTOOR, THRISSUR, KERALA.",22/09/2021,21/09/2026,11
418,Kerala,Thrissur,3 Star,,Central Hotel Agencies,"Museum Road, Chembukavu, Thrissur.",10/12/2018,9/12/2023,10
419,Kerala,Thrissur,3 Star,,CHERAKULAM TOURIST HOME,"TANA,IRINJALAKUDA,THRISSUR DT.",18/11/2019,17/11/2024,10
420,Kerala,Thrissur,3 Star,,DAYA REGENCY,DAYA REGENCY MANNUTHY ROAD PARAVATTANI THRISSUR - 680005 ,5/10/2018,4/10/2023,10
421,Kerala,Thrissur,3 Star,,Deliza Residency,Vazhani Road Wadakanchery-Post Thrissur-Ditrict,17/11/2022,16/11/2027,20
422,Kerala,Thrissur,3 Star,,"Devasura Inn, A Unit of Devasura Inn Private Limited","KUNNATHUR, PUNNAYOORKULAM.P.O, THRISSUR Thrissur",20/08/2019,19/08/2024,11
423,Kerala,Thrissur,3 Star,,Fort Gate Hotels and Resorts (A unit of Fort Gate Hotels and Resorts Private Limited),"KOTTAPPADY, GURUVAYOOR, THRISSUR Thrissur Thrissur",18/11/2019,17/11/2024,18
424,Kerala,Thrissur,3 Star,,GOLDEN BAR,"GOLDEN BAR,KODAKARA.THRISSUR [DIST] KERALA-680684 ",10/12/2018,9/12/2023,10
425,Kerala,Thrissur,3 Star,,HAMARA HOTELS,"A UNIT OF HAMARA HOTELS PRIVATE LIMITED, NADATHARA.P.O, NH 47 BY PASS, THRISSUR DISTRICT",16/09/2020,15/09/2025,20
426,Kerala,Thrissur,3 Star,,HIGHWAY PALACE INN,"PATTIKKAD,THRISSUR, DISTRICT,KERALA",26/09/2018,25/09/2023,20
427,Kerala,Thrissur,3 Star,,HOLIDAY PARK,"PUDUKKAD JUNCTION, THRISSUR DISTRICT, KERALA STATE",5/10/2018,4/10/2023,13
428,Kerala,Thrissur,3 Star,,HOTEL APSARA,"MAIN ROAD, CHALAKUDY, THRISSUR",16/07/2019,15/07/2024,10
429,Kerala,Thrissur,3 Star,,Hotel Ayodhya Regency ,"Hotel Ayodhya Regency ,Triprayar, Thrissur Dist ",2/1/2019,1/1/2024,10
430,Kerala,Thrissur,3 Star,,Hotel Clay House,"Muringoor.P.O, Chalakudy",26/09/2018,25/09/2023,25
431,Kerala,Thrissur,3 Star,,Hotel Dreamland,"Triprayar, Nattika P.O.",28/06/2019,27/06/2024,19
432,Kerala,Thrissur,3 Star,,HOTEL HILL TOP,"134, HOTEL HILL TOP, P.O VELUTHUR, KUNNATHANGADI, THRISSUR",15/06/2021,14/06/2026,11
433,Kerala,Thrissur,3 Star,,Hotel Kottaram Residency,"Opp.Apollo Tyres, Perambra Thrissur",21/11/2022,20/11/2027,17
434,Kerala,Thrissur,3 Star,,HOTEL MOON AND SHOPPING COMPLEX ,"PAVARATTY P.O ,THRISSUR , Thrissur",16/07/2021,15/07/2026,10
435,Kerala,Thrissur,3 Star,,HOTEL NEW CASTLE,"OTTUPARA, WADAKKANCHERRY.P.O, THRISSUR DISTRICT Thrissur",25/07/2019,24/07/2024,10
436,Kerala,Thrissur,3 Star,,HOTEL OAK TREE ,"A UNIT OF MOSA & SONS TOWER INN PRIVATE LIMITED, THIRUVILWAMALA.P.O, THRISSUR DISTRICT",25/10/2021,24/10/2026,14
437,Kerala,Thrissur,3 Star,,Hotel Park Residency,"Koorkkanchery P O, Thrissur",20/06/2019,19/06/2024,12
438,Kerala,Thrissur,3 Star,,HOTEL PENINSULA,"Trichur Tourist Complex Pvt.Ltd, M G Road, Thrissur,Kerala.",30/03/2020,29/03/2025,12
439,Kerala,Thrissur,3 Star,,Hotel Salkara,Chavakkad Chettuva road Thrissur,16/09/2022,15/09/2027,10
440,Kerala,Thrissur,3 Star,,HOTEL SEVEN SEAS,"RAMAKRISHNA IYYER ROAD,IRINJALAKUDA,THRISSUR DISTRICT",15/06/2021,14/06/2026,11
441,Kerala,Thrissur,3 Star,,Hotel Simla,"P.O.Kanjany , Thrisssur Dist",20/01/2020,19/01/2025,10
442,Kerala,Thrissur,3 Star,,HOTEL SREE GOKULAM RESIDENCY (A UNIT OF SREE GOKULAM HOTELS INDIA PVT.LTD),"AMBALLUR P.O.,PUDUKKAD,THRICHUR",22/09/2022,21/09/2027,20
443,Kerala,Thrissur,3 Star,,HOTEL WAYLORD,"A Unit of Hotel Waylord Private Limited, Thiroor.P.O, Thrissur District, Kerala State, Pin: 680581 ",6/7/2020,5/7/2025,10
444,Kerala,Thrissur,3 Star,,Hotel Zodiac,"Koratty, Thrissur Dist.",19/12/2019,18/12/2024,10
445,Kerala,Thrissur,3 Star,,Keli Residency ( A Unit of Keli Hotels Private Limited),"Gramala.P.O, Mulagunnathukavu, Athani, Thrissur District Thrissur",29/12/2019,28/12/2024,19
446,Kerala,Thrissur,3 Star,,Kovilakam Inn (A unit of Kovilakam Inn India Private Limited),"KAIPARAMBU.P.O, Thrissur",6/7/2020,5/7/2025,13
447,Kerala,Thrissur,3 Star,,LUMBINI SUPREME,"TC 30-383-2, R S ROAD, OLLUR P O , THRISSUR",16/07/2021,15/07/2026,10
448,Kerala,Thrissur,3 Star,,M.R.TOURIST HOME,"VELLANGALLUR, P.O. THRISSUR",25/03/2022,24/03/2027,10
449,Kerala,Thrissur,3 Star,,MAY FAIR HOTELS,"PUDUKAD, THRISSUR DIST.",17/07/2019,16/07/2024,10
450,Kerala,Thrissur,3 Star,,Mayura Inn,Mannuthy Bypass Jn.Mannuthy PO Thrissur Kerala 680651,22/04/2019,21/04/2024,18
451,Kerala,Thrissur,3 Star,,Peringottukara Palace,"Kizhakkumury P O, Peringottukara, Thrissur",22/09/2022,21/09/2027,14
452,Kerala,Thrissur,3 Star,,"Polakulath Tourist Home,Kodugallor","North Nada, Kodugallor, Thrissur",28/01/2019,27/01/2024,10
453,Kerala,Thrissur,3 Star,,POORAM RESIDENCY HOTEL INDIA PRIVATE LIMITED,"P.O.KODANNUR, THRISSUR DISTRICT",24/07/2018,23/07/2023,13
454,Kerala,Thrissur,3 Star,,Rose Residency,"Madayikonam p.o, Mapranam, Trissur",7/10/2019,6/10/2024,10
455,Kerala,Thrissur,3 Star,,Solar Hotels (A unit of Solar Hotels Pvt Ltd.),Pavaratty P.O Thrissur Thrissur,25/10/2021,24/10/2026,10
456,Kerala,Thrissur,3 Star,,THE NADUMURI INN,"ANNAMANDA, P.O.THRISSUR,DIST,KERALA STATE",24/08/2018,23/08/2023,11
457,Kerala,Thrissur,3 Star,,VICTORY INTERNATIONAL,BYJU ROAD KUNNANKULAM Thrissur,29/04/2019,28/04/2024,10
458,Kerala,Tirur,3 Star,,HOTEL DEEPA RESTAURANT,"DEEPA HOTEL AND RESTAURANT, TOWN HALL ROAD , TIRUR, MALAPPURAM Tirur Tirur Tirur",20/06/2019,19/06/2024,12
459,Kerala,Tirur,3 Star,,Hotel Salkara,"Manjadi,Tirur Road, Kuttippuram PO, Pin 679571, Tirur Taluk, Malappuram Dist., Kerala.",30/09/2022,29/09/2027,11
460,Kerala,Valancherry,3 Star,,SWAGATH INN,"PATTAMBI ROAD, VALANCHERY ",30/09/2022,29/09/2027,12
461,Kerala,Varkala,3 Star,,Hindustan Beach Retreat,"Papanasam Beach, Janardhanapuram PO,",20/11/2018,19/11/2023,27
462,Kerala,Varkala,3 Star,,hotel varkala park international,"Station Road Varkala , Thiruvananthapuram-695141",9/6/2020,8/6/2025,16
463,Kerala,Wayanad,3 Star,,HOTEL SAUGANDHIKA WEST GATE,"Kolagapara P O, Meenangadi , Wayanad District",11/1/2023,10/1/2028,12
464,Kerala,Wayanad,3 Star,,Hotel Manasasaras,"Thalassery Road, Mananthavady, Wayand - 670 645",28/09/2018,27/09/2023,13
465,Kerala,Wayanad,3 Star,,HOTEL MAYO,"MENNANGADI,WAYANAD DISTRICT",25/10/2021,24/10/2026,12
466,Kerala,Wayanad,3 Star,,HOTEL VANARANI,"MEENANGADI, WAYANAD",22/11/2021,21/11/2026,10
467,Kerala,Wayanad,3 Star,,STERLING HOLIDAY RESORTS LTD,"STERLING HOLIDAY RESORTS LTD, VALLU VADI POST, VALLUVADI VILLAGE, SULTHAN BATHERRY, WAYANAD DISTRICT.",29/03/2019,28/03/2024,61
468,Madhya Pradesh,Avarghani,3 Star,,PENCH JUNGLE CAMP,"PENCH NATIONAL PARK, VILLAGE AVARGHANI, TEH. KURAI,",4/1/2023,3/1/2028,31
469,Madhya Pradesh,Bhopal,3 Star,,HOTEL AMER PALACE,"209 ZONE 1, MP NAGAR",4/7/2019,3/7/2024,55
470,Madhya Pradesh,Bhopal,3 Star,,Hotel Amer Palace,"209, Zone-1, MP Naagr, Bhopal",4/7/2019,3/7/2024,55
471,Madhya Pradesh,Tikamgarh,3 Star,,Silver Estate Resort,"6 Mile Stone, Jhansi Road, Phadikhurd, Tikamgarh",26/10/2022,25/10/2027,50
472,Maharashtra,Ahmednagar,3 Star,,Hotel Yash Grand ,"Near Kinetic Chowk, Nagar-Pune Road, Ahmednagar. ",7/7/2022,6/7/2027,27
473,Maharashtra,Amravati,3 Star,,THE GRAND MEHFIL,"NAZUL PLOT NO. 11-2, SHEET NO. 31,BEHIND DAYA SAGAR HOSPITAL, GIRLS HIGH SCHOOL SQUARE,CAMP ROAD,",15/02/2019,14/02/2024,79
474,Maharashtra,Andheri (East),3 Star,,Hotel Om Tunga Vihar,"Plot No. B 11, MIDC Central Road, Andheri (East).",29/07/2022,28/07/2027,20
475,Maharashtra,Andheri (East),3 Star,,The Regale by Tunga(A unit of Hotel Tunga Regale (India) Pvt. Ltd.),"PLOT NO. 31, PHASE II, MIDC, CENTRAL ROAD, ANDHERI EAST, MUMBAI 400 093 Andheri (East)",29/07/2022,28/07/2027,49
476,Maharashtra,Aurangabad,3 Star,,LEMON TREE HOTEL AURANGABAD,"R-7 2, AIRPORT ROAD, CHIKALTHANA, AURANGABAD",7/7/2022,6/7/2027,102
477,Maharashtra,Lonavala,3 Star,,The Fern (A Unit of Agarwal Hospitality Pvt. Ltd.),S. No. 84 - 1 to 4 off Mumbai pune expressway near Lonavala expressway exit Valavan Maval Lonavala Pune,8/3/2020,7/3/2025,80
478,Maharashtra,Mulshi,3 Star,,Atmantan Resort Wellness Health Centre ,"Village Palse, Mulshi, Pune ",9/5/2022,8/5/2027,108
479,Maharashtra,Mumbai,3 Star,,Citizen Hotel (A UNIT OF CITIZEN HOTELS PVT. LTD.),"960, JUHU TARA ROAD, JUHU BEACH Mumbai",6/7/2020,5/7/2025,43
480,Maharashtra,Mumbai,3 Star,,HOTEL SUNCITY RESIDENCY,16TH ROAD MIDC MAROL ANDHERI EAST MUMBAI 400093,27/05/2019,26/05/2024,35
481,Maharashtra,MUMBAI,3 Star,,Hotel Tunga Paradise,"Plot No. 16, MIDC Central Road, Andheri (East), Mumbai, Maharashtra. City : Mumbai MUMBAI MUMBAI",15/07/2022,14/07/2027,40
482,Maharashtra,Mumbai,3 Star,,KEYS HOTEL NESTOR ,"382 SWAROOP ENCLAVE, MAKHWANA ROAD , OFF MILITARY ROAD , OPP ECO PARK BUILD., MAROL, ANDHERI EAST , MUMBAI -400059. Mumbai",4/7/2019,3/7/2024,100
483,Maharashtra,Mumbai,3 Star,,"Kohinoor Elite, A Unit of Kohinoor Elite Hotels Pvt Ltd. ","Kohinoor City, Kirol Road, Near American School of Bombay, Off LBS Marg, Kurla (West). Mumbai",8/4/2021,7/4/2026,100
484,Maharashtra,Mumbai,3 Star,,Peninsula Redpine Hotel (A Unit of The Competent Hotel Private Limited,"CTS 1355, Andheri-Kurla Road, Marol, Mumbai Mumbai",11/3/2022,10/3/2027,29
485,Maharashtra,Mumbai,3 Star,,Sea Palace Hotel,"P.J Ramchandani Marg, Apollo Bunder, Colaba, Mumbai-400001",1/5/2019,30/04/2024,47
486,Maharashtra,Mumbai,3 Star,,Soho House Mumbai,"Plot no. 16, Juhu Tara Road, Santa Cruz (W), Mumbai Mumbai Mumbai",2/9/2019,1/9/2024,36
487,Maharashtra,Mumbai,3 Star,,THE MIRADOR,"131-B, NEW LINK ROAD, CHAKALA, ANDHERI (EAST), MUMBAI - 400099",17/11/2022,16/11/2027,106
488,Maharashtra,Nagpur,3 Star,,Hotel Naivedhyam North Star,"28 A, Jagdamba Niwas, Near Koradi, Nagpur - 441111",18/02/2020,17/02/2025,38
489,Maharashtra,Nagpur,3 Star,,Tadoba Vanya Villas Resort and Spa (a unit of Royale Blue Resorts India Private Limited),"Khasra No.41,144,152,154,155 & 402.AT MOUZA CHETI, TEHSIL CHIMUR, DIST. CHANDRAPUR, NEAR TADOBA ANDHERI TIGER RESERVE, MAHARASHTRA Nagpur",21/11/2022,20/11/2027,36
490,Maharashtra,Nashik,3 Star,,Hotel Grand Rio (A Unit of CMP Hospitality) ,"S. NO- 881-2-PLOT NO -3, RAJIV NAGAR, CHADDA CHOWK, OFF MUMBAI AGRA ROAD Nashik",15/05/2019,14/05/2024,45
491,Maharashtra,Navi Mumbai,3 Star,,HOTEL HIGHWAY VIEW,"PLOT NO.3, SECTOR-24. OPP. SANPADA RAILWAY STATION, MUMBAI PUNE HIGHWAY, NAVI MUMBAI",7/8/2020,6/8/2025,20
492,Maharashtra,Navi Mumbai,3 Star,,Hotel Supreme Heritage,"Plot No. L-2, Sector -19, Vashi , Navi Mumbai- 400703",16/07/2019,15/07/2024,61
493,Maharashtra,Palghar,3 Star,,ANCHAVIYO RESORTS,BHARAT AGRI FERT AND REALITY LTD SURVEY NO 155 7 8 9 10 VILLAGE KHARIVALI TALUKA WADA DIST MAHARASHTRA,9/5/2019,8/5/2024,16
494,Maharashtra,Pune,3 Star,,Ginger Pune-Wakad,Ginger Hotel Kala Khdak Near Indira College Wakad naka Wakad,25/01/2019,24/01/2024,127
495,Maharashtra,Pune,3 Star,,IBIS HOTEL - PUNE (UNIT OF INTERGLOBE HOTELS PRIVATE LIMITED),"Survey No: 32, Viman Nagar, Nagar Road, Pune, Maharashtra - 411014, India",15/10/2018,14/10/2023,160
496,Maharashtra,Thane,3 Star,,GCC HOTEL AND CLUB,"GCC HOTELS PVT. LTD., 92-1, OFF. MIRA BHAYANDER ROAD, MIRA ROAD EAST, THANE.",25/07/2019,24/07/2024,106
497,Maharashtra,Thane,3 Star,,GCC Hotels Private Limited,"GCC Hotel and club, S.no. 921, off Mira Bhayander road, near vijay sales, Mira Road East, Thane - 401107",20/08/2018,19/08/2023,48
498,Maharashtra,Thane,3 Star,,Krishna Palace,35-36 MIDC Additional Ambernath East Thane,29/05/2019,28/05/2024,58
499,Manipur,Imphal*,3 Star,,"Elora Hotel, a unit of Chingao Hotel and Resorts Pvt. Ltd.","Ward No. 9, Indo Myanmar Road, Moreh, Chandel District",27/07/2018,26/07/2023,28
500,Meghalaya,Shillong*,3 Star,,HOTEL POINISUK,"LAITUMKHRAH MAIN ROAD, UPLAND ROAD, NONGKYNRIH",31/10/2018,30/10/2023,30
501,Odisha,Angul,3 Star,,ASHIANA HILL VIEW,"ADARSH VIHAR , PANCHA MAHALA , NEAR RTO OFFICE , ANGUL",25/03/2022,24/03/2027,80
502,Odisha,Jajpur Road,3 Star,,Ginger Hotel Kalinganagar,"Ginger Hotel, Opp Tata Steel Gate no 3, Khurunti, Kalinganagar, Odisha, 755026",8/8/2022,7/8/2027,93
503,Odisha,Jharsuguda,3 Star,,THR ORCHARD (Garden Palace Hotels Resorts Pvt Ltd,"Bypass Road, Ekatali, Jharsuguda",7/7/2022,6/7/2027,50
504,Odisha,Puri,3 Star,,"MAYFAIR Waves, Puri","Chakratirtha Road, Puri- 752002, Puri District, Odisha",19/04/2021,18/04/2026,34
505,Odisha,Talcher,3 Star,,Hotel Surya Garden,"Netaji Subas Bose Marg, Main Road, Talcher, Dist: Angul, Odisha, PIN: 759107",8/4/2021,7/4/2026,38
506,Punjab,Jalandhar,3 Star,,COUNTRY INN SUITES BY RADISSON A UNIT OF HAYRE REGENCY HOTELS PRIVATE LIMITED,NEAR BSF CHOWK G.T ROAD ,29/03/2019,28/03/2024,45
507,Punjab,Jalandhar,3 Star,,Hotel Imperia Suites,"Vasant Vihar Road, Shanker Garden, Near Income Tax Colony, Jalandhar",22/01/2020,21/01/2025,18
508,Rajasthan,Jaipur,3 Star,,Hotel Le Grande ,Jaipur Road Chomu ,11/1/2023,10/1/2028,19
509,Rajasthan,Jaipur,3 Star,,Mansingh Towers,"Hotel Mansingh Towers, Sansar Chandra Road",15/07/2020,14/07/2025,53
510,Rajasthan,Jaipur,3 Star,,RCL JAIPUR,"Ginger Hotel, Hawa Sadak, Civils Lines, Jaipur",11/1/2023,10/1/2028,103
511,Tamil Nadu,Chennai*,3 Star,,BEVERLY,NO 17 RAJARATHINAM ROAD KILPAUK CHENNAI,22/04/2019,21/04/2024,52
512,Tamil Nadu,Thanjavur,3 Star,,SANGAM HOTELS,"TRICHY ROAD, THANJAVUR",15/10/2022,14/10/2027,57
513,Telangana,Hyderabad,3 Star,,BESTWESTERN ASHOKA,"6-1-70, LAKDI-KA-PUL",1/4/2022,31/03/2027,88
514,Telangana,HYDERABAD,3 Star,,Minerva Grand - Kompally,"Survey No 105, Beside Cine Planet, Kompally,",25/11/2021,24/11/2026,42
515,Telangana,Hyderabad,3 Star,,OHRIS BANJARA (A UNIT OF HOTEL KAMAL PVT LTD ),"D NO 8-2-682 - 3,ROAD NO 12, BANJARA HILLS, HYDERABAD-500034 Hyderabad",31/03/2022,30/03/2027,24
516,Telangana,Hyderabad,3 Star,,Tara,"Hotel Tara, Ramojii Film City, Anajpur, RR District - 501512",11/3/2022,10/3/2027,126
517,Telangana,Hyderabad,3 Star,,VAISHNAOI HOTELS INDIA PVT LTD,"3-2-8481,Kachiguda,Station Road,Kachiguda,Hyderabad.",2/8/2018,1/8/2023,41
518,Uttar Pradesh,Ghaziabad,3 Star,,Fortune Inn Grazia,"Plot No :.1,Sector:.23, Sanjay Nagar,Distt. Centre.",7/10/2019,6/10/2024,50
519,Uttarakhand,Ramnagar,3 Star,,The Manor Kashipur (Unit of R.R.Hotels),"Bazpur Road , Udham singh Nagar, Kashipur , Uttrakhand 244713",22/09/2022,21/09/2027,30
520,West Bengal,Asansol,3 Star,,HOTEL ASANSOL INTERNATIONAL,"66, G.T. ROAD (EAST), ASANSOL",25/03/2022,24/03/2027,42
521,West Bengal,Bankura,3 Star,,HOTEL SAPTAPARNA,"AVINASH SARANI, CHANDMARIDANGA, BANKURA",11/2/2021,10/2/2026,24
522,West Bengal,Bishnupur,3 Star,,HOTEL ANNAPURNA,"COLLEGE ROAD ,P.O- BISHNUPUR, DIST-BANKURA, ",4/7/2019,3/7/2024,45
523,West Bengal,Durgapur,3 Star,,The Peerless Inn Durgapur,"Sahid Khudiram Sarani, City Centre, Durgapur - 713216",25/01/2022,24/01/2027,108
524,West Bengal,Kolkata,3 Star,,ETHNOTEL ( A UNIT OF RAHA HOSPITALITY PVT LTD),"71 I 1 JESSORE ROAD, AIRPORT 2.5 NO GATE Kolkata",6/8/2020,5/8/2025,41
525,West Bengal,Kolkata,3 Star,,GALLERY HOTELS AND RESORTS,"67, BAGMARI ROAD , KOLKATA - 700054",4/1/2023,3/1/2028,34
526,West Bengal,Kolkata,3 Star,,Hotel De Sovrani,DD21 SECTOR I SALT LAKE KOLKATA 700064 Kolkata,10/5/2019,9/5/2024,55
527,West Bengal,Kolkata,3 Star,,Hotel Walson,5A Sudder Street,15/07/2022,14/07/2027,29
528,West Bengal,Kolkata,3 Star,,IBIS HOTEL - KOLKATA (A UNIT OF INTERGLOBE HOTELS PRIVATE LIMITED),"NO:30 - 1111, PLOT NO. BG - 9, STREET NO: 1111, NEW TOWN, POLICE STATION DISTT. NORTH 24, PARGANAS, KOLKATA - 700156, WEST BENGAL",30/01/2020,29/01/2025,189
529,West Bengal,Kolkata,3 Star,,Jameson Inn Shiraz,56 Park Street,7/11/2019,6/11/2024,40
530,West Bengal,Kolkata,3 Star,,Kolkatta Hotels Ltd (Holiday Inn Express-Airport Kolkata),"28, jessore road, nscbi airport, dum dum",25/10/2021,24/10/2026,130
531,West Bengal,Kolkata,3 Star,,Park Prime Kolkata (A unit of Chocolate Hotels Pvt. Ltd.),"226, AJC BOSE ROAD,KOLKATA Kolkata",19/02/2021,18/02/2026,62
532,West Bengal,Kolkata,3 Star,,REGENTA LARICA INN,"BISWA BANGLA ROAD , NOAPARA , CHINAR PARK , RAJARHAT , NEW TOWN , KOLKATA 700157 kolkata",4/7/2019,3/7/2024,45
533,West Bengal,Kolkata,3 Star,,SENS HOTELS PVT LTD - UNIT (BRAND) REGENTA ORKO'S KOLKATA by Royal Orchid Hotels,"621, PRANTIK PALLY, KASBA, KOLKATA - 700 107",1/4/2022,31/03/2027,69
534,West Bengal,Kolkata,3 Star,,The Fern Residency Kolkata (a unit of Protect Vanijya Pvt. Ltd.,"AS 213, NOAPARA, 204 MAIN ARTERIAL ROAD,NEW TOWN,KOLKATA-700157.",2/11/2020,1/11/2025,48
535,West Bengal,Kolkata,3 Star,,The Golden Park,13 Ho Chi Minh Sarani,1/9/2020,31/08/2025,50
536,West Bengal,Kolkata,3 Star,,VICTORIA HOTEL,"45, CHINAR PARK, KOLKATA",4/1/2023,3/1/2028,34
537,Andhra Pradesh,Kakinada,4 Star,With Alcohol,Grand Kakinada by GRT Hotels,"11-3-11, Veterinary hospital road, Ramarao Peta, Kakinada",7/12/2022,6/12/2027,83
538,Andhra Pradesh,Vijayawada,4 Star,With Alcohol,Quality Hotel D V Manor,"40-1-47, M G Road, Vijayawada - 520 010 Vijayawada",17/12/2018,16/12/2023,119
539,Andhra Pradesh,Visakhapatnam,4 Star,With Alcohol,Fairfield By Marriott (A Unit Of KSR Developers Pvt Ltd),"S.No.106-1B2, Marripalem, near R&B Guest House, Madhavadhara Area,",7/10/2019,6/10/2024,121
540,Andhra Pradesh,Visakhapatnam,4 Star,With Alcohol,FORTUNE INN SREEKANYA,D.NO 47-10-34&35 NEAR DIAMOND PARK DWARAKANAGAR ,18/11/2019,17/11/2024,68
541,Andhra Pradesh,Visakhapatnam,4 Star,With Alcohol,HOTEL DASPALLA,"28-2-48,SURYABAGH, VISAKHAPATNAM ",1/10/2019,30/09/2024,125
542,Andhra Pradesh,Visakhapatnam,4 Star,With Alcohol,WelcomHotel Grand Bay,"15-1-44 Maharanipeta , Beach road, visakhapatnam",30/03/2020,29/03/2025,104
543,Chhattisgarh,Bilaspur,4 Star,With Alcohol,HOTEL EAST PARK,"AGRASEN CHOWK, LINK ROAD NO 1",22/09/2022,21/09/2027,78
544,Chhattisgarh,Raipur*,4 Star,With Alcohol,HOTEL GRAND IMPERIA (UNIT OF GRAND ARSH,VIP ROAD RAIPUR ,30/03/2022,29/03/2027,30
545,Chhattisgarh,Raipur*,4 Star,With Alcohol,Clarks Inn Suites,"GE Road, Near VIP Square, Telibandha, Raipur",8/4/2021,7/4/2026,51
546,Chhattisgarh,Raipur*,4 Star,With Alcohol,HOTEL BABYLON INN PVT LTD,"JAIL ROAD, RAIPUR",17/10/2019,16/10/2024,72
547,Chhattisgarh,Raipur*,4 Star,With Alcohol,HOTEL CELEBRATION,"SHRI GURU GOVIND SINGH SQUARE, JAIL ROAD",17/05/2019,16/05/2024,43
548,Chhattisgarh,Raipur*,4 Star,With Alcohol,Hyatt Raipur (A Unit of Chartered Hotels Private Limited),"Magneto The Mall, N.H. 6 Labhandi, Raipur, Chhattisgarh, India, 492 001",9/5/2022,8/5/2027,105
549,Chhattisgarh,Raipur*,4 Star,With Alcohol,Sayaji Hotel Raipur,"GE Road, Behind Magneto Mall |Raipur – ",30/03/2022,29/03/2027,101
550,Delhi,Delhi,4 Star,With Alcohol,Crowne Plaza Mayur Vihar,"13B, Mayur Vihar District Center, Delhi-110091 Delhi",7/2/2022,6/2/2027,159
551,Delhi,Delhi,4 Star,With Alcohol,HOLIDAYINN,"ASSET AREA-12, HOSPITALITY DISTRICT, AEROCITY",25/07/2022,24/07/2027,265
552,Delhi,Delhi,4 Star,With Alcohol,Hotel City Park,"KP Block,Pitampura",2/8/2018,1/8/2023,58
553,Delhi,Delhi,4 Star,With Alcohol,Hotel Holiday Inn,"Plot NO. 13A, Mayur Vihar District Center",5/2/2022,4/2/2027,192
554,Delhi,New Delhi,4 Star,With Alcohol,Crowne Plaza New Delhi Rohini,"Plot 3B 1, Twin District Centre, Sector 10, Rohini, New Delhi",8/3/2020,7/3/2025,183
555,Delhi,New Delhi,4 Star,With Alcohol,CROWNE PLAZA NEW DELHI ROHINI,"PLOT NO. 3B1, TWIN DISTRICT CENTRE, SECTOR-10, ROHINI, DELHI",8/3/2020,7/3/2025,183
556,Delhi,New Delhi,4 Star,With Alcohol,CROWNE PLAZA TODAY NEW DELHI OKHLA,"PLOT NO. 1, COMMUNITY CENTRE, OKHLA PHASE-I, NEW DELHI-110020.",11/3/2022,10/3/2027,208
557,Delhi,New Delhi,4 Star,With Alcohol,EDENPARK HOTELS PVT LTD,"SHAHEED JEET SINGH MARG, NEW DELHI - 110016",22/07/2019,21/07/2024,30
558,Delhi,New Delhi,4 Star,With Alcohol,"Hilton Garden Inn New Delhi ,Saket","A-4,DLF Place Saket District Center, New Delhi-110017",18/12/2018,17/12/2023,115
559,Delhi,New Delhi,4 Star,With Alcohol,PRIDE HOTEL LIMITED,"ASSET-5A, AEROCITY, IGI AIRPORT, NEW DELHI-110037",20/11/2018,19/11/2023,378
